sentence,stance,sentence_length
"Fifth, successful and timely completion of the class projects (see details below) will give you an additional five (5) cumulative grade points, however, failure to successfully complete the projects will result in a ten (10) point reduction in your cumulative score.  THE脗聽TERM脗聽PAPER:脗聽脗聽脗聽脗聽脗聽脗聽脗聽脗聽 Your脗聽instructor脗聽has脗聽individually脗聽assigned脗聽you脗聽a脗聽topic脗聽which脗聽you脗聽will脗聽receive脗聽on脗聽 the脗聽class脗聽Bulletin脗聽Board脗聽under脗聽the脗聽芒聙聹term脗聽paper芒聙聺脗聽icon.脗聽脗聽It脗聽is脗聽expected脗聽that脗聽all脗聽 sources脗聽you脗聽utilize脗聽in脗聽the脗聽paper脗聽will脗聽be脗聽properly脗聽cited.脗聽The脗聽paper脗聽will脗聽be脗聽typed,脗聽 double脗聽spaced,脗聽and脗聽consist脗聽of脗聽at脗聽least脗聽five脗聽(5)脗聽pages,脗聽it脗聽will脗聽also脗聽be脗聽stapled脗聽 together脗聽(no脗聽paper脗聽clips脗聽or脗聽covers).脗聽脗聽A脗聽cover脗聽芒聙聹page芒聙聺脗聽is脗聽fine.脗聽脗聽The脗聽paper脗聽will脗聽be脗聽 graded脗聽on脗聽its脗聽content,脗聽your脗聽ability脗聽to脗聽follow脗聽directions,脗聽attention脗聽to脗聽grammar,脗聽 spelling,脗聽and脗聽its脗聽general脗聽structure.脗聽脗聽The脗聽paper脗聽will脗聽generate脗聽a脗聽possible脗聽score脗聽of脗聽five脗聽 (5)脗聽percentage脗聽points脗聽toward脗聽your脗聽final脗聽total.脗聽This脗聽means脗聽that脗聽if脗聽you脗聽do脗聽all脗聽that脗聽is脗聽 required脗聽of脗聽you,脗聽your脗聽paper脗聽will脗聽give脗聽you脗聽a脗聽score脗聽of脗聽five.脗聽If脗聽however,脗聽you脗聽do脗聽not脗聽do脗聽 the脗聽paper脗聽or脗聽if脗聽the脗聽job脗聽you脗聽do脗聽is脗聽substandard,脗聽you脗聽will脗聽receive脗聽a脗聽fifteen脗聽(15)脗聽point脗聽 deduction脗聽in脗聽your脗聽final脗聽total.脗聽If脗聽you脗聽have脗聽any脗聽questions脗聽regarding脗聽this脗聽scoring脗聽 process脗聽please脗聽ask脗聽me脗聽in脗聽class.脗聽If脗聽you脗聽have脗聽a脗聽question脗聽someone脗聽else脗聽probably脗聽does脗聽 also.脗聽THIS脗聽PAPER脗聽MUST脗聽CONFORM脗聽TO脗聽APA脗聽STANDARDS脗聽IN脗聽ALL脗聽REFERENCES脗聽IN脗聽 THE脗聽BODY脗聽OF脗聽THE脗聽PAPER脗聽AND脗聽THE脗聽REFERENCE脗聽PAGE.脗聽If脗聽you脗聽are脗聽not脗聽familiar脗聽with脗聽 these脗聽requirements脗聽a脗聽detailed脗聽publication脗聽of脗聽these脗聽requirements脗聽can脗聽be脗聽 purchased脗聽at脗聽the脗聽college脗聽book脗聽store.脗聽DO脗聽NOT,脗聽UNDER脗聽ANY脗聽CIRCUMSTANCES,脗聽 UTILIZE脗聽芒聙聹WIKIPEDIA芒聙聺脗聽AS脗聽A脗聽REFERNCE脗聽IN脗聽ANY脗聽FORM脗聽FOR脗聽THIS脗聽PAPER.脗聽DOING脗聽SO脗聽 WILL脗聽CAUSE脗聽YOUR脗聽PAPER脗聽TO脗聽BE脗聽REJECTED.脗聽IN脗聽ADDITION,脗聽ANY脗聽PLAGERISM脗聽OF脗聽THE脗聽 MATERIAL脗聽FOR脗聽THIS脗聽PAPER脗聽WILL脗聽RESULT脗聽IN脗聽THE脗聽REJECTION脗聽OF脗聽THE脗聽PAPER脗聽AND脗聽 POSSIBLY脗聽FAILURE脗聽FOR脗聽THE脗聽CLASS.脗聽脗聽  EXTRA脗聽CREDIT脗聽OPTIONS:脗聽There脗聽are脗聽several脗聽ways脗聽to脗聽earn脗聽extra脗聽credit脗聽points脗聽during脗聽 this脗聽course.脗聽The脗聽first脗聽is脗聽""Big脗聽L""脗聽points.脗聽These脗聽points脗聽are脗聽acquired脗聽each脗聽time脗聽you脗聽 respond脗聽in脗聽class脗聽to脗聽a脗聽question脗聽that脗聽substantially脗聽contributes脗聽to脗聽the脗聽course脗聽subject脗聽 matter.脗聽(this脗聽usually脗聽means脗聽you脗聽have脗聽prepared脗聽yourself脗聽by脗聽reading脗聽the脗聽text脗聽and脗聽 doing脗聽the脗聽assignments脗聽and/or脗聽researching脗聽relevant脗聽material).脗聽Second,脗聽is脗聽to脗聽post脗聽 on脗聽the脗聽class脗聽Bulletin脗聽Board脗聽a脗聽response脗聽to脗聽an脗聽extra脗聽credit脗聽topic.脗聽These脗聽topics脗聽are脗聽 given脗聽out脗聽in脗聽class脗聽so脗聽be脗聽sure脗聽to脗聽watch脗聽for脗聽them.脗聽Here脗聽is脗聽the脗聽procedure脗聽you脗聽must脗聽 adhere脗聽to脗聽in脗聽order脗聽to脗聽receive脗聽credit脗聽for脗聽your脗聽posting.脗聽1.脗聽Research脗聽the脗聽topic,脗聽write脗聽a脗聽 paragraph脗聽or脗聽two脗聽describing脗聽what脗聽information脗聽you脗聽have脗聽found脗聽and脗聽state脗聽your脗聽 opinion脗聽of脗聽it.脗聽2.脗聽Post脗聽the脗聽paragraph脗聽and脗聽the脗聽article,脗聽link,脗聽etc.,脗聽you脗聽have脗聽located.脗聽If脗聽 your脗聽posting脗聽is脗聽noteworthy脗聽for脗聽the脗聽class,脗聽I脗聽will脗聽respond脗聽to脗聽you脗聽in脗聽the脗聽Vista脗聽email脗聽 site脗聽with脗聽the脗聽instructions脗聽to脗聽""print脗聽and脗聽bring""脗聽your脗聽posting.脗聽You脗聽will脗聽print脗聽out脗聽your脗聽 posting脗聽and脗聽write脗聽your脗聽first脗聽and脗聽last脗聽name脗聽across脗聽the脗聽top.脗聽You脗聽will脗聽then脗聽bring脗聽the脗聽 posting脗聽to脗聽the脗聽next脗聽class脗聽session脗聽and脗聽turn脗聽it脗聽in脗聽to脗聽me.脗聽All脗聽Big脗聽L脗聽and脗聽extra脗聽credit脗聽 points脗聽are脗聽cumulative脗聽grade脗聽points,脗聽this脗聽means脗聽that脗聽after脗聽your脗聽exams脗聽are脗聽 averaged脗聽these脗聽points脗聽are脗聽added脗聽to脗聽your脗聽score.脗聽Yes,脗聽that's脗聽right,脗聽you脗聽could脗聽 conceivably脗聽score脗聽only脗聽C's脗聽on脗聽your脗聽exams脗聽and脗聽still脗聽earn脗聽an脗聽A脗聽in脗聽the脗聽course,脗聽it脗聽all脗聽 depends脗聽on脗聽how脗聽much脗聽work脗聽you脗聽want脗聽to脗聽do.脗聽If脗聽you脗聽have脗聽questions脗聽regarding脗聽 extra脗聽credit脗聽points脗聽please脗聽feel脗聽free脗聽to脗聽ask脗聽them脗聽in脗聽class脗聽at脗聽any脗聽time.脗聽 CLASS脗聽PROJECTS:脗聽 The脗聽class脗聽projects脗聽are脗聽three脗聽page脗聽papers脗聽which脗聽must脗聽be脗聽submitted脗聽on脗聽the脗聽 schedule脗聽indicated脗聽on脗聽the脗聽class脗聽website.脗聽Please脗聽pay脗聽special脗聽attention脗聽to脗聽the脗聽 attachments脗聽you脗聽utilize脗聽when脗聽posting脗聽the脗聽paper.脗聽There脗聽are脗聽special脗聽instructions脗聽on脗聽 the脗聽website,脗聽be脗聽sure脗聽to脗聽read脗聽them.脗聽You脗聽must脗聽do脗聽seven脗聽of脗聽the脗聽eight脗聽papers,脗聽they脗聽 will脗聽not脗聽be脗聽graded脗聽but脗聽if脗聽they脗聽are脗聽substandard脗聽they脗聽will脗聽be脗聽rejected脗聽and脗聽you脗聽will脗聽 be脗聽notified脗聽re芒聙聬write脗聽and脗聽re芒聙聬submit脗聽the脗聽paper.脗聽If脗聽you脗聽fail脗聽to脗聽do脗聽seven脗聽papers脗聽or脗聽if脗聽a脗聽 paper脗聽is脗聽rejected脗聽and脗聽you脗聽do脗聽not脗聽re芒聙聬submit脗聽it脗聽within脗聽one脗聽week脗聽after脗聽rejection脗聽you脗聽 will脗聽receive脗聽A脗聽FIFTEEN脗聽(15)脗聽POINT脗聽REDUCTION脗聽IN脗聽YOUR脗聽CUMULATIVE脗聽GRADE脗聽 SCORE.脗聽脗聽 Details脗聽of脗聽class脗聽project:脗聽On脗聽the脗聽class脗聽website脗聽you脗聽will脗聽find脗聽the脗聽topic脗聽for脗聽each脗聽 project脗聽paper.脗聽In脗聽three脗聽(3)脗聽pages脗聽you脗聽will脗聽need脗聽to脗聽do脗聽two脗聽things,脗聽describe脗聽the脗聽  problem脗聽to脗聽be脗聽addressed脗聽and脗聽provide脗聽the脗聽solution脗聽to脗聽the脗聽problem脗聽that脗聽YOU脗聽would脗聽 recommend脗聽if脗聽you脗聽had脗聽the脗聽opportunity脗聽(power)脗聽to脗聽do脗聽so.脗聽This脗聽paper脗聽is脗聽designed脗聽to脗聽 incorporate脗聽your脗聽perspective脗聽as脗聽well脗聽as脗聽those脗聽of脗聽the脗聽芒聙聹experts芒聙聺.脗聽That芒聙聶s脗聽all脗聽you脗聽have脗聽 to脗聽do,脗聽define脗聽the脗聽problem脗聽and脗聽give脗聽me脗聽your脗聽solution.脗聽脗聽 I脗聽HIGHLY脗聽ADVISE脗聽YOU脗聽TO脗聽DO脗聽THESE脗聽PAPERS脗聽EARLY,脗聽ESPECIALLY脗聽THE脗聽FIRST脗聽ONE.脗聽 IF脗聽YOU脗聽EXPERIENCE脗聽COMPUTER/TECHNICAL脗聽DIFFICULTIES脗聽WHEN脗聽SUBMITTING脗聽 YOU脗聽WILL脗聽BE脗聽ABLE脗聽TO脗聽RESOLVE脗聽THE脗聽PROBLEM脗聽WELL脗聽IN脗聽ADVANCE脗聽OF脗聽THE脗聽 DEADLINE脗聽DATE.脗聽YOU脗聽CAN脗聽DO脗聽THESE脗聽PAPERS脗聽AT脗聽ANY脗聽TIME,脗聽THEY脗聽JUST脗聽CANNOT脗聽 BE脗聽SUBMITTED脗聽PAST脗聽THE脗聽DUE脗聽DATES.脗聽THOSE脗聽WHO脗聽PLAN脗聽AHEAD脗聽WILL脗聽ALWAYS脗聽 DO脗聽BEST脗聽IN脗聽THIS脗聽CLASS.脗聽脗聽  Attendance:脗聽 I脗聽do脗聽not脗聽take脗聽attendance.脗聽I脗聽believe脗聽your脗聽education脗聽is脗聽芒聙聹your芒聙聺脗聽responsibility脗聽and脗聽you脗聽 should脗聽be脗聽treated脗聽as脗聽adults.脗聽However,脗聽past脗聽experience脗聽has脗聽repeatedly脗聽 demonstrated脗聽that脗聽it脗聽is脗聽extremely脗聽difficult脗聽to脗聽pass脗聽this脗聽course脗聽without脗聽regular脗聽 attendance.脗聽(ESPECIALLY脗聽SINCE脗聽THE脗聽CLASS脗聽脗聽PHYSICALLY脗聽MEETS脗聽ONLY脗聽TWO脗聽脗聽DAYS脗聽 A脗聽WEEK)脗聽 Critical Thinking: The ability to think and write critically are essential skills in many walks of life",discouraging,933
I will need to approve your thesis statement before you start writing so that you don芒聙聶t bite off more than you can chew (and this part of the assignment is worth 25 points).  Note: Wikipedia is not an acceptable source for a research paper. However you may use sources listed under the relevant Wikipedia entry,discouraging,55
(Wikipedia.com is not a legitimate source for the purpose of scholarly research and may not be used.) We will have bibliographic instruction for this paper. The paper itself should be 5 to 7 pages in length excluding the Bibliography,discouraging,39
Wikipedia is not a good source because there is no formal review process. 茂聝聵 Word processing programs have spelling and grammar checking capabilities 芒聙聯 use them! 茂聝聵 Visit the Writing Lab 芒聙聯 they are extremely helpful,discouraging,36
"29-March 6  Chapter 7 Motivation Chapter 8 Orientation, Training, and Development  Read Chapters 7 & 8/handouts; Submit Discussion Question and Respond to a classmate; Practice quiz; [PERSON][PERSON]on proposals  March 7-March 13 7 PROJECT PROPOSAL DUE by Sunday, March 8 (10 points)  PROJECT PROPOSAL DUE by Sunday, March 13 (10 points) ****Please do not use Wikipedia",discouraging,55
"What is primary literature? http://ase.tufts.edu/biology/courses/bio14/primain.htm (not Wikipedia, [PERSON] [PERSON], etc.) Fermented Product Research (Individual Project) 2,500 words (single of double spaced, your call) Addresses Outcomes #1, #2, & #3 Recognize fermented food and beverage products in our daily lives and use the underlying scientific knowledge of these products as a guide for their optimal production and/or consumption",discouraging,57
"The explanation must be clear, rational, and concise. Inadequate documentation: Notes taken in class, or excerpts from 芒聙聹.com芒聙聺 internet sites Wikipedia, or blogs are not authoritative or allowed documentation",discouraging,29
"Ex: (Week 1) -entries will be written in popular diction and between 200-300 words Rhetorical Analysis (2) 50 Critical Reading / Design and Culture -1st due April 3 -2nd due May 8 -each will be written in formal diction, MLA format, 1-2 pages, and with quotes from the text Literary Analysis (4/17) 100 Place -written in formal diction, MLA format, 3-4 pages, and with 3 sources (online sources must be from a .edu, .gov, or a .org - wikipedia, sparknotes, bookrags, or other 芒聙聹study aid芒聙聺 sites are not acceptable) MidTerm (5/1) 100 Identity -written in informal diction, MLA format, 2-3 pages Object Analysis (5/17) 100 Design and [PERSON] [PERSON] in formal diction, MLA format, 3-4 pages, and with 4 sources (online sources must be from a .edu, .gov, or a .org - 芒聙聹wiki芒聙聺 is not acceptable) Presentation (6/5 - 6/7) 50 -multimedia presentation of final persuasive project -presenter should incorporate some multimedia tools: powerpoint, prezi, music, photos, videos, etc",discouraging,159
"You choose the topic, but the paper must cover a subject within the scope of the class (Europe 1815-present) and have at least three sources, of which two must be a primary source, or a book or scholarly article (an article written by an historian -- NOT Wikipedia, Newsweek, etcetera)",discouraging,50
You may NOT use WIKIPEDIA as a source,discouraging,8
Wikipedia is not   脗聽a credible source. 芒聙垄 Speech paperwork must be typed   脗聽and   脗聽a   脗聽reference   脗聽list   脗聽must   脗聽always   脗聽accompany   脗聽the   脗聽 outline   脗聽of speeches that require sources,discouraging,37
"茂聛聤 Why Wikipedia will not be used in this class for your papers, projects, or any other assignment: 芒聙垄 You can get ideas from Wikipedia, but they're usually not engaging sources",conditional,31
Avoid using Wikipedia or unreliable websites as your final sources. Writing tip You already got a lot of writing advice in the first paragraph of instructions,discouraging,26
"museum websites, actual news sites). o YOU MAY NOT USE WIKIPEDIA, RANDOM BLOGS, ETC. DO NOT PLAGIARIZE. o Do not copy and paste any text from the internet",discouraging,28
"I will not give credit for sources listed on visual aids but not mentioned orally. Wikipedia does not count as a valid source. When selecting your topics please keep in mind that somewhere in each speech you need to discuss the business/economics/government policies/taxes/personal finances aspect of your topic. The topic for Speech #1 must pertain to an inventor who (or invention that) has changed America or the world in some way, or a business leader who has made a significant impact. You should avoid topics with which most people are already familiar, such as the telephone, the assembly line, Facebook, etc",discouraging,101
Wikipedia is NEVER an appropriate college-level resource,discouraging,7
"Only one, credible website is allowed (this does not include accessing articles through the library research databases). 脗搂 Topic must be approved 1 week before presentation to ensure no repeats and appropriateness. 脗搂 Typed Works Cited (Reference) page in APA format 脗搂 Outline芒聙聰Preparation (turned into me on BlackBoard) 脗搂 No more than FIVE 3x5 inch notecards (one side only) 脗搂 NO Wikipedia, Yahoo, Wikipedia, About.com, etc. 脗搂 Visual Aid(s) required Team/Group Presentation (Informative or Persuasive Presentation 15-20 minutes) Following a systematic decision-making process, your team will plan and deliver a 15-20 (3-5 minutes per person in group) minute informative or persuasive presentation on a relevant business topic (see the topics below for ideas)",discouraging,113
"The final case typically has 6 or more sources and they should not be other student papers, blogs, wikipedia (or other reference/dictionary type sites), but should be professional credible sources",discouraging,30
Not doing so is plagiarism. 茂聜路 The library provides style guide resources: http://usi.libguides.com/citingsources. 茂聜路 Do not use Wikipedia as a reference; it will result in earning 0% for the paper. 茂聜路 Potential Deductions o 10% for not using references properly o 5% for inaccurate information o 10% for poor grammar o 10% for length 茂聜路 Please refer to Appendix 1 for more details,discouraging,63
"You must cite at least three academic references; do NOT use Wikipedia, a dictionary or a thesaurus as an academic reference",discouraging,21
Wikipedia is not a permitted source,discouraging,6
"NOTE: Wikipedia, while sometimes a helpful place to begin research, is NOT a reliable source.  Instructor Bio: [PERSON] [PERSON] [PERSON] is a former staff writer for the Los Angeles Times and [PERSON] [PERSON], as well as the author of three trade paper original books for Westminster John Knox Press, with more than 200,000 copies in print",conditional,56
Students should dress professionally for all speeches. 茂聜路 Speaking order will be determined in advance according to whatever guidelines the instructor sets forth. 茂聜路 Students should minimize use of Wikipedia,conditional,30
"As part of your presentation, you are required to provide each student in the class with a two to three-page hand-out, which needs to include, among other things, the mains points of your research, a full bibliography and at least two questions for further discussions and/or research. The use of Wikipedia is strongly discouraged beyond employing it as a starting point similar to an encyclopedia",conditional,65
Students may quote and cite [PERSON] in their surf-the-web reports as long as Wikipedia is not the only source of information,conditional,21
"Be careful if you access sites such as Wikipedia, Investopedia and any such 芒聙聵pedia芒聙聶 sites, as these sites are not reliable sources for complete and completely accurate information on many (most) financial topics! Please utilize your campus (online) library and its sources.  13  ITDE Instructional Design | Texas A&M University-Commerce",discouraging,50
"Do not use Wikipedia!!! As you conduct your research for this paper, I would like you to add articles to your paper or pictures if you find anything of interest",discouraging,30
"Google Scholar is the easiest way to find academic sources; I also recommend that you speak with a reference librarian if you are having difficulty finding/assessing sources. Unacceptable sources: websites (without consent of instructor) or sources without clear authorship., e.g. Wikipedia",discouraging,41
"These exams will be based on the material in the textbook.  Group Presentation  -  (see below)  400 Pages Outside Reading  -  in preparation for the Group Presentation assignment; beyond the assigned reading in the text (PLEASE NOTE: WIKIPEDIA AND THE LIKE ARE NOT ACCEPTABLE SOURCES).         EVALUATION       The course grade will be determined as follows:       Four Sectional Exams 70%       Group Presentation  20%             400 Pages Reading  10%  (NO PARTIAL CREDIT)                               100%       Grade Scale:        A 94 - 100             B 87 - 93             C 80 - 86             F Below 80        PLEASE NOTE: No assignment will be accepted after its due date/time, except in extreme situations",discouraging,101
"Wikipedia, InfoPlease, a middle schooler芒聙聶s blog) are not acceptable sources. Your paper proposal should be about 1 page in length.  GRADING VALUES AND TIME ESTIMATES Assignment Reading Responses Mid-Term Exam Final Exam Research Paper Research Paper Proposal Class attendance  Percentage 25% (10 x 2.5%) 20% 20% 30% 5% 100%  VI.  Estimated Time 40 hours 5 hours 5 hours 30 hours 5 hours 40 hours 135 urs  POLICIES A.  B.  Class Attendance",discouraging,71
"The group may use textbooks sparingly and other books, but no Wikipedia",discouraging,12
"Plagiarism 脙垄芒聜卢脜聯is the practice of claiming, or implying, original authorship or incorporating material from someone else's written or creative work, in whole or in part, into one's own without adequate acknowledgement脙垄芒聜卢芒聙聦 (Source: Wikipedia)",discouraging,33
"However, do not use encyclopedic sites (Wikipedia, ask.com, about.com, webmd.com, even Britannica, and the like) as encyclopedias are not scholarly sources, even when scholars wrote them",discouraging,26
"Never use sites like Wikipedia, About.com, Yahoo answers, or Sparknotes as sources in an academic paper. Students should review all previous day芒聙聶s lecture notes and/or handouts prior to class each day in order to be prepared for quizzes. The instructor reserves the right to amend this syllabus.  7  If you arrive late to class, please do so quietly with as little disturbance to the class as possible. Quizzes are given at the beginning of class",discouraging,75
"RESEARCH NOTES: 脙聜脗搂 Avoid 脙垄芒聜卢脜聯user-content脙垄芒聜卢脗聺 sites (for example, Wikipedia) as a research source",discouraging,13
"Do not use internet sites such as Wikipedia, blogs or factoid sites. 3",discouraging,13
You are expected to use at least 10 outside sources (not wikipedia entries) in this paper,discouraging,16
"Double spacing is also an APA requirement which is the required writing style for this course.  Encyclopedia Sources, Wikipedia, and Blogs:  These sources are not acceptable as a major source of information and will be accepted only when used to support information from professional articles and books",discouraging,47
"You may use a website, which cannot be Wikipedia, and only as ONE of your sources",discouraging,16
Hint: Find a different version of the same map online. Osceola Mudflow 芒聙聰 Electron Mudflow 芒聙聰 Citation of source where information was found (no Wikipedia or other encyclopedia 芒聙聯 this is college) Why do you trust this source?  9,discouraging,39
"Avoid multi-sentence quotes and block quotes unless they are absolutely necessary, as long passages of quoted material tend to dis-tract the reader from your message. Sources to Avoid Avoid citing open-sources and/or general knowledge sources such as Wikipedia, encyclopedias, dictionaries (unless absolutely necessary), books of quotations or quote sites like [PERSON], and study guides such as Cliff's Notes and SparkNotes",discouraging,60
"[PERSON] [PERSON] [PERSON][PERSON] site on China Politics Links from Wellesley College; --you may want to read ahead to [PERSON] [PERSON][PERSON] article, assigned under the ""Religion"" Unit for this assignment; --be sure to consult the sources and resources page for more ideas, and I'm sure you'll find plenty more on your own (no Wikipedia please); but --if you're really at a loss, [PERSON] [PERSON] at [PERSON] [PERSON] has kindly agreed to help out (he knows what this assignment requires), so you can get in touch with him [[EMAIL]; [PHONE]] In the interests of simulating the prevailing socio-political mood of the Cultural Revolution, you'll post your self criticism on the discussion board thread ""Self-Criticism"" AND your peers will then engage in a process of evaluating whether or not you have rectified incorrect thinking. Please see the Course Schedule for deadlines. [assignment adapted from Prof",discouraging,142
"This means that you are to exclude from consideration non-scholarly online (and other) sources, including general interest encyclopedias such as Wikipedia",discouraging,21
"Generally, an excerpt from Wikipedia is present for its readability, but Wikipedia is only usable as a point of comparison, not as ""official"" materials, which need to be found on official websites for governments and entities",discouraging,36
"339-382 in The Holocaust Film: Survivors of the Shoah Discussion  June 28, 2010:  Final Exam (Bring a Blue Book) Research Paper Due (this grade will be considered incomplete until your paper has been submitted to turnitin.com)  Grading Policy Grades will be based on class attendance and participation (20%); one 6-8 page research paper with an annotated bibliography (25%); one test (25%); and one final (30%). Wikipedia is not an accepted as a source for your papers in this class",discouraging,79
"Students are expected to demonstrate achievement of clinical objectives by the end of a clinical course. Student:  Instructor:  Student芒聙聶s Score  Grading Rubric for Reflection Assignments  Evaluation Criteria Content of post is accurate and complete 茂聜路 Addresses all reflection questions 茂聜路 Answers each reflection question completely 茂聜路 Answers each reflection question accurately. 茂聜路 (demonstrates energy investment and thoughtfulness throughout posts) Documents resources used 茂聜路 Accurately integrates material from resources into text of discussion post using own words (no lengthy quotations, no cut and paste from other sources). 茂聜路 Uses textbooks, journal articles, and reports from professional sources to provide evidence and give support for statements made in discussion posts. 茂聜路 Utilizes APA format throughout reflection post, including in-text citations and reference list 茂聜路 A minimum of 2 references should be used to support posted statements. 茂聜路 Wikipedia and WebMD are not acceptable sources for citations and references. Uses clear, correct, and precise language 茂聜路 Communicates in writing on a baccalaureate level with correct academic English spelling, word use, and grammar. 茂聜路 Language is clear, well-organized, and complete. 茂聜路 Uses technical terms correctly and appropriately Communicates respectfully with peers and faculty 茂聜路 Demonstrates courteous, respectful, and supportive written tone in discussion posts",discouraging,200
"Additional information will be provided in class. Presentation and Report 1 芒聙聯 Use a variety of journals, books, and Web sources (not Wikipedia!) to thoroughly research an assigned quality or productivity methodology. Interpret and evaluate the current status of the topic and its applicability in the real world",discouraging,48
"For your history/background section, you need to cite at least three academic sources by different authors (no Wikipedia)",discouraging,18
