sentence,stance,sentence_length
"IMPORTANT: Note that Wikipedia is reliable for some subjects but not for others, and may be one of your sources ONLY if you verify the information you get from [PERSON] from a print source, and cite that source",conditional,38
"Use of sites such as Wikipedia are not allowed for this project nor are any outside sources not approved by your professor! Your paper must have a title, be typewritten, 10 to 12 point standard font size, 1inch margins, stapled and your pages numbered",discouraging,44
"Thus, do not use Wikipedia as your primary source of information",conditional,11
"Examples of plagiarism are (1) submitting an assignment as if it were one's own work when, in fact, it is at least partly the work of another; (2) submitting a work that has been purchased or otherwise obtained from an Internet source or another source; and (3) incorporating the words or ideas of an author into one's paper without giving the author due credit.  Intro to Literature 4  Please read the complete policy at http://www.sfasu.edu/policies/academic_integrity.asp Do not be tempted to go to Wikipedia, Yahoo Answers, or one of the many free essay sites on the Internet",discouraging,96
"A key critic: [PERSON] [PERSON][PERSON]Reading to have done: the 芒聙聹ennials芒聙聺: http://news.artnet.com/art-world/worlds-top-20-biennials-triennials-andmiscellennials-18811; participatory art: http://www.artnews.com/2011/01/01/youre-engaged/; [PERSON][PERSON][PERSON]: http://www.formerwest.org/Team/ClaireBishop LOOKING at ourselves, and at others TH 9/10 The Gaze and other ways to See lecture We view the first part of [PERSON] [PERSON][PERSON] The Artist is Present, 2012  4  T 9/15 We view the second part of [PERSON] [PERSON][PERSON] The Artist is Present, 2012 TH 9/17 Discuss [PERSON] [PERSON]芒聙聶s The Artist is Present, 2012: does it change how we see? 芒聙垄 View the audio-slide show on eyes from the Metropolitan Museum of Art芒聙聶s Connections: http://www.metmuseum.org/connections/eyes#/Complete/ 芒聙垄 Examine MoMA芒聙聶s website with videos about the [PERSON] retrospective: http://www.moma.org/visit/calendar/exhibitions/965 T 9/22 - The sexualized body/person: Discuss Milo Moir脙漏芒聙聶s Naked Selfies, 2015 芒聙垄 [PERSON] [PERSON] website - look at her most recent projects and read the British and North American press about her work: http://www.milomoire.com/?page_id=1559 芒聙垄 芒聙聹The Male Gaze芒聙聺: http://finallyfeminism101.wordpress.com/2007/08/26/faq-what-is-the%E2%80%9Cmale-gaze%E2%80%9D/ 芒聙垄 芒聙聹Gays and the Gaze芒聙聺: http://www.beyondmasculinity.com/articles/ahmed.php?page=1 What does [PERSON]芒聙聶s work say about ideal female nudes in culture today? TH 9/24 - The disabled body/person: Discuss [PERSON] [PERSON]芒聙聶s [PERSON] [PERSON] (8 months), 2000 芒聙垄 Read the official description of the commission: https://www.london.gov.uk/priorities/artsculture/fourth-plinth/commissions/marc-quinn 芒聙垄 Read the following press articles about the work: http://www.theguardian.com/artanddesign/2005/sep/18/art; http://www.nytimes.com/2005/10/10/a rts/design/in-trafalgar-square-much-ado-about-statuary.html?_r=0 芒聙垄 芒聙聹Why We Stare芒聙聺: http://www.emory.edu/EMORY_MAGAZINE/2009/autumn/staring.html What does Quinn芒聙聶s work say about non-ideal bodies in culture today? T 9/29 - The racialized body/person: Discuss [PERSON] [PERSON]芒聙聶s My White Friends, 2007 芒聙垄 Examine Greene芒聙聶s webpages on her project (and read the essay by [PERSON] [PERSON][PERSON][PERSON]): http://www.myragreene.com/projects.html What, if anything, do Greene芒聙聶s photos capture about whiteness in America? TH 10/1 and T 10/6 We view [PERSON] [PERSON][PERSON] film Self Made, 2011 TH 10/8 Discuss [PERSON] [PERSON][PERSON] film Self Made, 2011. What does Wearing芒聙聶s film say about how we see ourselves, how we want to be seen, and how we see others? Is the film liberating and/or exploitative? FIVE-PAGE ESSAY ON THE ABOVE QUESTIONS DUE: you must bolster your argument by citing at least three significant articles and/or websites (no Wikipedia and your endnotes do not constitute a page of the essay)",encouraging,334
"Wikipedia is not acceptable as a reference. Examples of family issues and policies include, but are not  3  NURS 815  limited to: Issues related to children, parents, or elders, immigrants; poor families in the welfare system; parental leave from employment for family issues, elder care policies, health care access and insurance issues, impact of current laws on individuals (e.g., child support & custody laws; immigration law).  2",conditional,67
Wikipedia is not an appropriate source for this assignment,discouraging,9
"In other words, unattributed sources such as Wikipedia-The Free Encyclopedia cannot count as one of your sources. All written assignments are to be: 芒聙垄 word-processed and computer-printed, with 芒聙垄 text double-spaced, using 12-point font for body copy (headings/subheads, if used, can be slightly larger; footnotes can be slightly smaller), with 芒聙垄 pages having 1-inch margins on all four sides and numbered (no number needed for first page), 芒聙垄 clearly labeled with student name, course number, and submission date preceding the main title or assignment name. All submissions should use collegiate-level vocabulary, employ a scholarly literary style, and should not include language or style of a colloquial nature (i.e., no incomplete or run-on sentences, misspellings, [PERSON], etc.)",conditional,116
"5  3  Feb. 6-Feb. 12  TEXT READING/ MAJOR TOPICS Before you begin the course (Week 1), read this information and complete the following tasks (list on right-hand side)  ASSIGNMENTS DUE ***Due dates and times are listed in the course. Post class Introduction/reply 2 classmate芒聙聶s introductions; Review Syllabus/take syllabus quiz; Familiarize yourself with the course  Read Chapter 1/handout; Take Practice quiz 1; Submit discussion question and Respond to classmate  Chapter 1/ Fundamentals Of Human Relations Chapter 2 Emotional Read Chapters 2 & 3/handouts; Intelligence Submit Discussion Question and Chapter 3 Knowing Respond to classmate; Practice Yourself: Personal quiz. and Organizational Values Chapter 4 Managing Read Chapter 4/handout; Yourself: Stress, Submit Time, and Career Discussion Question and Management Respond to classmate; Practice quiz; Start project Review for Test 1  4  Feb. 13-Feb. 19 Test # 1  5  Feb. 20-Feb. 26  6  Feb. 27-March 5  Chapter 5 Creativity, Innovation, and Read Chapters 5 & 6/handouts; Entrepreneurial Submit Thinking Discussion Question and Respond to classmate; Practice Chapter 6/ quiz; Work on proposals Communicating in the Workplace  Chapter 7 Motivation Chapter 8 Orientation, Training, and Development  7  Test #1-Chapters 1-4 (CLOSED BOOK)  March 6-March 12  PROJECT PROPOSAL DUE by Sunday, March 12 (10 points)  Read Chapters 7 & 8/handouts; Submit Discussion Question and Respond to a classmate; Practice [PERSON]; Work on proposals  PROJECT PROPOSAL DUE by Sunday, March 12 (10 points) ****Please do not use Wikipedia",discouraging,231
No references can be from Wikipedia.,discouraging,6
"It is a great way to get acquainted with different authors and ideas, but it does not work as academic citation. You can use the site but then you must check on the references and quote from the references read, not from the information supplied by Wikipedia. When you cite an outside source, you must cite it in academically acceptable formats. This includes references to websites",discouraging,66
This means you can芒聙聶t use material found in the 芒聙聹juvenile芒聙聺 section of the library or anything from a potentially unreliable website芒聙聰 like Wikipedia芒聙聰no matter how good you think its material is,discouraging,31
"Wikipedia is convenient for casual use, but it is NOT a reliable source for this report because it is 芒聙聹open source.芒聙聺 This means  that anyone can modify the content on the website so you might be using information from the website that is not current or accurate. There are guides on researching databases in the content section of this course, labeled 芒聙聹Resources芒聙聺. Assignment Format: Students must identify the reliable sources they used to create the assignment using appropriate APA format for the reference page. You do not need to include in-text citations",discouraging,92
"At least 3 ACADEMIC sources (NOT Wikipedia, nor a blog, nor the textbook) must be used and noted",discouraging,18
An assignment is considered a day late if it is turned in after the designated due date/time.  Do not use Wikipedia as a reference for your assignments,discouraging,27
"Not acceptable are general textbooks (i.e.: books with titles like Greece from 1900 to the Present), Wikipedia and encyclopedias, though the latter two may have useful bibliographic references you may look up.  You must cite the source you are using within the text",discouraging,43
"Do not use Wikipedia, About.com or similar sources of information for any of the assignments in this class",discouraging,18
"While essential information of the type found on Wikipedia can help inform the class, it is the personal examination and, if applicable, inspiration of each visionary that will determine a successful Profile",encouraging,32
"Formatting is evaluated based on the 6th edition, 2nd printing (2010) of the APA Manual 芒聙聯 which is a required textbook for the course. Web sources such as Wikipedia, Epodunk, [PERSON], and [PERSON] are not considered scholarly or evidence-based and will not be accepted as sources within the course",conditional,49
[PERSON] immediately.  The glorious internet: a cautionary note Are you tempted to have a look at Wikipedia or other 芒聙聹encyclopedic芒聙聺 sites on the web? For this course you are FORBIDDEN to do so for the entirety of the semester unless specifically instructed,discouraging,42
"The length of this introduction will depend upon the grade you wish to make in the class.  7  Grading Rubrics  - A 芒聵聟 芒聵聟 芒聵聟 芒聵聟 芒聵聟  minimum of fifteen sources; see source guidelines below minimum word count for the introduction 芒聙聯 600 words respond to instructor芒聙聶s mid-term suggestions with improvements must hand in draft as a Pages file by Wednesday, October 11 @ 5:00 pm completed project due as a Pages file by Wednesday, November 22 at 5:00 pm  - B 芒聵聟 芒聵聟 芒聵聟 芒聵聟 芒聵聟  minimum of eleven sources; see source guidelines below minimum word count for the introduction 芒聙聯 450 words respond to instructor芒聙聶s mid-term suggestions with improvements must hand in draft as a Pages file by Wednesday, October 18 @ 5:00 pm completed project due as a Pages file by Wednesday, November 22 at 5:00 pm  - C 芒聵聟 芒聵聟 芒聵聟 芒聵聟 芒聵聟  minimum of seven sources; see source guidelines below minimum word count for the introduction 芒聙聯 300 words respond to instructor芒聙聶s mid-term suggestions with improvements must hand in draft as a Pages file by Wednesday, October 25 @ 5:00 pm completed project due as a Pages file by Wednesday, November 22 at 5:00 pm  - D 芒聵聟 芒聵聟 芒聵聟 芒聵聟 芒聵聟  minimum of four sources; see source guidelines below minimum word count for the introduction 芒聙聯 200 words respond to instructor芒聙聶s mid-term suggestions with improvements must hand in draft as a Pages file by Wednesday, November 1 @ 5:00 pm completed project due as a Pages file by Wednesday, November 22 at 5:00 pm  8  Important Information 芒聙垄  Guidelines for sources: - At least one of your sources must be The Grove Dictionary of Music and Musicians (either Oxford Online or in the library reference area). - The following are NOT permitted as sources: Wikipedia articles the course textbook my online video lectures - All online sources must include links to those sources in your list of sources. 芒聵聟 芒聵聟 芒聵聟  芒聙垄  Style guidelines for bibliographical entries: - I would prefer that you use the formatting style of the MLA (Modern Language Association). - For guidelines follow this link to the Purdue OWL (Online Writing Lab). - [PERSON] to the examples and guidelines for 芒聙聹MLA Works Cited.芒聙聺  芒聙垄  A Word about Plagiarism - If plagiarism is found, your project will be dismissed and the highest possible grade you can make in the course will be a 芒聙聹D.芒聙聺 - Extreme cases of plagiarism will be referred to the School of Music Administration and/or the Dean of Students for disciplinary action. - You must cite sources when using ideas or quotes from those sources. - Be aware that I have access to online plagiarism trackers, and I send the texts of all submitted books through these trackers",discouraging,461
"(Examples of these types of credible online resources are The DEA Government Website, The FBI Government Website, and Bureau of Justice Statistics). Do not use Wikipedia as one of your ten resources for the paper",discouraging,35
"Wikipedia also has useful information: look up the words: vector, plane",encouraging,11
Wikipedia is not an acceptable source of information; nor are blogs,discouraging,11
DO NOT ! - I REPEAT - DO NOT! USE WIKIPEDIA Adjustments may be required to the schedule if TJC is officially closed following policy guidelines,discouraging,26
"Students using Wikipedia will be penalized 10 points. Text: [PERSON] [PERSON] [PERSON], ed",discouraging,13
"an   脗聽explanation   脗聽of   脗聽how   脗聽each   脗聽group   脗聽member   脗聽contributed   脗聽to   脗聽the   脗聽final   脗聽submission.   脗聽     脗聽     脗聽 Individual   脗聽Activity:   脗聽Take   脗聽reading   脗聽quiz   脗聽   脗聽    脗聽    脗聽    脗聽    脗聽 Due:   脗聽September   脗聽7,   脗聽2012   脗聽 Take   脗聽the   脗聽reading   脗聽quiz   脗聽posted   脗聽in   脗聽Blackboard.   脗聽This   脗聽reading   脗聽quiz   脗聽will   脗聽cover   脗聽major   脗聽topics   脗聽from   脗聽this   脗聽module芒聙聶s   脗聽 lecture,   脗聽Chapter   脗聽5,   脗聽and   脗聽Section   脗聽7.1,   脗聽and   脗聽is   脗聽designed   脗聽to   脗聽make   脗聽sure   脗聽that   脗聽you   脗聽have   脗聽taken   脗聽notice   脗聽of   脗聽 important   脗聽information   脗聽that,   脗聽if   脗聽overlooked,   脗聽could   脗聽negatively   脗聽affect   脗聽your   脗聽comprehension   脗聽of   脗聽materials   脗聽and   脗聽 your   脗聽grade.   脗聽     脗聽 6   脗聽     脗聽 Group   脗聽Activity:   脗聽Submit   脗聽preliminary   脗聽bibliography   脗聽    脗聽    脗聽    脗聽 Due:   脗聽September   脗聽21,   脗聽2012   脗聽 Submit   脗聽a   脗聽preliminary   脗聽bibliography   脗聽for   脗聽your   脗聽analytic   脗聽project.   脗聽By   脗聽now,   脗聽you   脗聽should   脗聽have   脗聽completed   脗聽most   脗聽of   脗聽 the   脗聽research   脗聽needed   脗聽to   脗聽become   脗聽familiar   脗聽with,   脗聽and   脗聽conduct   脗聽analysis   脗聽of,   脗聽the   脗聽topic   脗聽you   脗聽chose,   脗聽and   脗聽should   脗聽 be   脗聽able   脗聽to   脗聽submit   脗聽a   脗聽properly   脗聽formatted   脗聽bibliography   脗聽of   脗聽the   脗聽sources   脗聽you芒聙聶re   脗聽using   脗聽for   脗聽your   脗聽analysis.   脗聽The   脗聽 sources   脗聽should   脗聽be   脗聽representative   脗聽of   脗聽a   脗聽wide   脗聽range   脗聽of   脗聽reference   脗聽materials.   脗聽DO   脗聽NOT   脗聽USE   脗聽WIKIPEDIA   脗聽AS   脗聽A   脗聽 SOURCE.   脗聽    脗聽     脗聽 Group   脗聽Activity:   脗聽Submit   脗聽Key   脗聽Assumptions   脗聽Check   脗聽exercise   脗聽    脗聽    脗聽 Due:   脗聽September   脗聽21,   脗聽2012   脗聽 Submit   脗聽the   脗聽key   脗聽assumptions   脗聽check   脗聽exercise.   脗聽Your   脗聽group   脗聽will   脗聽use   脗聽the   脗聽芒聙聹key   脗聽assumptions   脗聽check芒聙聺   脗聽(described   脗聽 in   脗聽Section   脗聽8.1)   脗聽to   脗聽identify   脗聽potential   脗聽flawed   脗聽assumptions   脗聽underlying   脗聽your   脗聽group芒聙聶s   脗聽hypotheses.   脗聽The   脗聽 written   脗聽portion   脗聽of   脗聽this   脗聽assignment   脗聽should   脗聽be   脗聽between   脗聽2   脗聽and   脗聽4   脗聽double-脗颅芒聙聬spaced   脗聽pages   脗聽in   脗聽length.   脗聽This   脗聽 assignment   脗聽must   脗聽include   脗聽the   脗聽following:   脗聽   脗聽 1",discouraging,436
