sentence,stance,sentence_length
"A searchable online edition of the 4th edition of this textbook can be found at: http://www.ncbi.nlm.nih.gov/books/bv.fcgi?call=bv.View..ShowTOC&rid=mboc4.TOC&depth=10 These three textbooks are also on reserve at BioMedical libraries. Wikipedia is a searchable reference website with explanations for nearly all of the specialized terminology used in the course. Week 1: March 30, Lecture 1: Diseases, genes, cell cycles, and chromosomes April 1, Lecture 2: Human disease pedigree and hemophilia Week 2: April 6, Lecture 3: Gene expression, mutation, and diseases of red blood cells April 8, Lecture 4: Epigenetics in gene expression, human diseases, and X-inactivation Week 3: April 13, Lecture 5: Meiotic disjunction and chromosomal numerical abnormalities April 15, Lecture 6: Gametogenesis, embryo development, infertility  Week 4: April 20, Lecture 7: Cell lines and animal models to study human diseases April 22, Lecture 8: Identification of disease genes by analyzing human genome Week 5: April 27, Lecture 9: Cystic fibrosis April 29, Lecture 10: Diabetes mellitus, an overview (guest lecture, [PERSON] [PERSON], [PERSON][PERSON][PERSON]) Week 6: May 4, Midterm exam May 6, Lecture 11: Human Mitochondrial Diseases Week 7: May 11, Lecture 12: Telomeres, genome stability and aging (guest lecture, [PERSON] [PERSON], [PERSON]) May 13, Lecture 13: Muscle disorders Week 8: May 18, Lecture 14: Signal transduction in metabolism and diabetes (guest lecture, [PERSON] [PERSON], [PERSON]) May 20, Lecture 15: Neurodegenerative diseases Week 9: May 25, Lecture 16: Cancer May 27, Lecture 17: Cell cycle and apoptosis related to cancer Week 10: June 1, Lecture 18: Signal transduction defect in cancer June 3, Lecture 19: Stem cells and gene therapy Class attendance: Students are expected to attend all lectures",encouraging,266
Wikipedia and ehow websites are not acceptable sources,discouraging,8
"[PERSON] for full credit. EBSCO host is a wonderful search engine for nursing journal articles.  These references can either be class notes, peer reviewed reference journals, or other appropriate text. You may not use random websites such as wikipedia, etc",discouraging,40
"Difference between reliable and non-reliable sources (e.g., Wikipedia vs Mayo Clinic for medical information)  3.  4.  Exploring browser plug-ins: audio, video, animation, 3D a.  How plug-ins get added  b.  List of popular plugins, such as Adobe Acrobat and Adobe Flash, etc  Web Communication: Lists, Chats, and [PERSON][PERSON][PERSON]  Facebook  b.  Twitter  c.  Blogs  Cultural Pluralism/Diversity Multiculturalism will be emphasized by recognizing diversity and raising awareness of cultural differences in the workplace",discouraging,70
Note: Wikipedia is NOT a reputable website and will not be accepted as one of the outside sources for this assignment. A rubric will be provided for this paper. All writing assignments should be in APA format in compliance with the American Psychological Association Publication Manual,discouraging,46
"Use at least five reputable references (A good choice is a professional journal such as Teaching Exceptional Children but not Good Housekeeping, Reader's Digest, or Wikipedia).  2  Research Paper Evaluation Rubric Student: _________________________ CONCEPTUAL LEVEL  Date: ______________  ACCURACY & THOROUGHNESS  WRITING  4",discouraging,42
"The use of Wikipedia, About.com, Suite101, InfoPlease, EHow and any open-source websites are not acceptable websites for citations at all in this course",discouraging,23
Please do not use Wikipedia to as an outside informational source. 5) Practitioner Plan (75 pts total) Field practitioners often have to implement policy that has been made far from the 芒聙聹front lines芒聙聺 and often without much input from those who do corrections work,discouraging,44
"While the Internet is a handy tool, Web pages such as Wikipedia are not acceptable sources unless you have cleared them with the instructor",discouraging,24
"Most sources are not from peer-reviewed journal articles and/or are not considered credible sources (e.g., Wikipedia)  Total  /10  Create a needs assessment plan for your proposed program, including approaches to measurement and Generated: 4/23/2018  Page 5 of 13  methods of data collection and analysis",discouraging,44
"Something like, ""[PERSON] [PERSON], 8am [PERSON] public speaking"" works perfectly.  You will be asked to sign a separate page, with acknowledging these things: SYLLABUS RECEIPT: I have received and read the syllabus for Speech 1315. I am responsible for its materials and policies. I acknowledge that there are certain requirements of this course, including:  -------------------------------------------------------------------------------- If I read my speech from notes, I will earn a zero for the assignment and all auxiliary parts of it.  --------------------------------------------------------------------------------  I must have all speech topics approved by the instructor or I will not be permitted to deliver the speech.  -------------------------------------------------------------------------------- I will be expected to use either MLA or APA format for all referenced materials.  -------------------------------------------------------------------------------- I will not deliver my speech without handing an outline to the teacher.  -------------------------------------------------------------------------------- Wikipedia is not allowed as a source/reference for speeches.  -------------------------------------------------------------------------------- I acknowledge that there are a few topics that will not be allowed in this class.",discouraging,154
"If you are unsure whether you need to cite an author, always err on the side of caution and cite the source of the information.  9  o Avoid citing Wikipedia, Answers.com, and related websites. Because anyone can post anything on these websites, we cannot be sure of the information芒聙聶s accuracy",discouraging,50
"Find three historical documents from a library database (so, no google or Wikipedia)",discouraging,13
"[PERSON] : Unlike many instructors, I find the use of Wikipedia articles to be acceptable resources",encouraging,16
"As a general rule, Wikipedia, Google, dictionary or encyclopedia entries, blogs, and even scientific sounding websites or magazines like Psychology Today are not appropriate sources for university-level work",discouraging,28
"Wikipedia should be a starting place for research only, not a final bibliographic item",encouraging,14
"You can get any additional sources from the UTSA databases (NO Wikipedia) or from newspapers, magazines and books. Starting TODAY, outside of class, you need to find, watch and take notes on at least TEN visual news stories (via television or online video news sources) from the standard,  10 corporate for profit network and cable news/entertainment shows such as CNN, ABC, Fox, MSNBC, CBS, NBC, to non-profits such as PBS Newshour or Frontline, to alternative online visual news programs such as Democracy Now or The Young Turks, etc",discouraging,88
"Examples:  Quality and Safety Education for Nurses (QSEN): http://www.qsen.org/    While using non-professional search engines and resources such as Google and Wikipedia are permitted, caution must be exercised to ensure material obtained from any source is supported by evidence-based information.            UNIVERSITY AND COLLEGE OF NURSING POLICIES:   PLEASE SEE THE COLLEGE OF NURSING WEBSITE FOR A FULL EXPLANATION OF EACH OF THE FOLLOWING POLICIES - http://nursing.ufl.edu/students/student-policies-and-handbooks/course-policies/.  Attendance Academic Honesty UF Grading Policy Accommodations due to Disability Religious Holidays Counseling and Mental Health Services Student Handbook Faculty Evaluations Student Use of Social Media  Approved: Academic Affairs Committee: General Faculty: UF Curriculum Committee: 09/09; 02/12 09/09; 03/12 10/09; 04/12",encouraging,105
Do not use Wikipediafor this report,discouraging,6
"You will not be able to go back and edit your post once it has been submitted to eCollege.  7) Here are the essentials for our discussion boards this semester: Try NOT to: Try to: Cardinal Rules- OBEY!!! Wikipedia cannot be used Do not rely on personal Take a firm stance & as a credible source of experiences as your 芒聙聹proof芒聙聺 defend it information The Bible cannot be used Do not rely on overlyPose a question to take the as an academic source of psychological or discussion deeper information psychoanalytical explanations Do NOT call people 芒聙聹crazy芒聙聺 Do not give us more to Engage in reciprocal read- summarize and interaction with other provide a link to a website students within a single for those who are curious, thread instead Do NOT attribute behavior Do not post overly-long or Give us something new to to the whims of individuals overly-complex responses think about in which patterns cannot be deciphered Do NOT simply say 芒聙聹I Do not wait until the last day Cite whenever appropriate agree芒聙聺 with someone芒聙聶s post to post",discouraging,178
Google and Wikipedia are NOT appropriate sources for a research paper,discouraging,11
"You must use the internet, but stay away from Wikipedia, which is an unreliable source",discouraging,15
"These are available online and hard copies of the StarTelegram芒聙聺 as well as The Shorthorn are available on campus in the University Center and in front of Room 118 in the Fine Arts Building.  o You may NOT use an aggregate news web site such as The Huffington Post, Yahoo!, or Google to find the answers.  茂聜路 Two kinds of questions will be on the quizzes o Current event questions will be taken from the news in these newspapers the week before the quiz is due 芒聙聰use ONLY the above approved publications above to find the correct answers to the current event questions. 茂聜路  Historical, miscellaneous knowledge and pop culture answers can be found via legitimate, trustworthy online sources (Wikipedia is NOT one of those) such as history.com, government websites and university websites",discouraging,133
WEBSITES SUCH AS WIKIPEDIA OR GOOGLE ARE NOT TO BE USED AS KEY SOURCES/REFERENCES IN YOUR PAPERS.  3.  Students will be expected to submit a typed response to a final examination,discouraging,31
Web MD is a valuable resource designed as a health education site for patients and families education -but not for this class. In this class please do not use the following sources for discussion groups or for assignments: Wikipedia Consumer directed literature Medical - surgical nursing textbooks How to Recognize Peer Reviewed Articles: http://www.angelo.edu/services/library/handouts/peerrev.html http://www.library.vanderbilt.edu/peabody/tutorials/scholarlyfree/ Note on Plagiarism: Angelo State University maintains a license with an online plagiarism detection service ([PERSON]),discouraging,71
"The use of materials generated by agencies engaged in 芒聙聹selling芒聙聺 term papers is also plagiarism.  WIKIPEDIA & OTHER OUTSIDE SOURCES  Even if correctly cited, Wikipedia or other outside sources should not be used on the midterm or final examination in this course",conditional,42
"Wikipedia芒聙聶s democratic and anonymous approach to knowledge is incompatible with scientific study because it breaks this chain of custody. This warning in a nutshell: Don芒聙聶t believe [PERSON], and definitely don芒聙聶t cite it in this class",discouraging,35
Do NOT use or cite Wikipedia as a source of reference in any of your written assignments,discouraging,17
"(That means no Wikipedia or Dictionary entries, for example.) You must annotate ten items. 茂聛露 Informal Writing Assignments and Participation (10%): This category includes in-class writing assignments, informal writing assignments, homework writing assignments, etc. 茂聛露 Celebration of Student Writing (10%): Friday, May 3 from 2PM 芒聙聯 4PM in The Field House. The Celebration of Student Writing is an event held every semester where students enrolled in ENG 1302 demonstrate and show-off what they learned in their research projects",discouraging,78
We will read some articles on using Wikipedia in the classroom and discuss this as a pedagogical method while we model it in the course,encouraging,25
"You are to use ACADEMIC REFERENCES (Wikipedia is NOT one) gleaned from Google Scholar, primary news sources, books, or the databases available at the Library",discouraging,25
"Web-based research can also be helpful, but sites such as Wikipedia do not provide high-quality source material",conditional,17
"To avoid copyright infringement site your sources, and do not 芒聙聹copy and paste,芒聙聺 and stay away from online resources such as Wikipedia",discouraging,22
"After covering these more general topics, we then move on to analyses of specific communication media and do hands-on projects that will help you understand how new media can help you as a college student and young professional. By the end of this course you should be able to      * engage with some of the major debates about the social impacts of new media    * shape your online identity in ways that will benefit you professionally    * understand the importance of maintaining a professional e-portfolio    * use different new media tools, such as Wikipedia, Google docs, and Twitter to help you with research    * use different tools to aid in collaborative projects    * compose projects in different forms, including written text, video, and audio    * understand some of the important pieces in the contemporary new media landscape (Linkedin, Reddit, Foursquare, Pinterest, etc.) Required books Baym, N",encouraging,146
"Do not borrow material from study guides, Wikipedia or other such online sources",discouraging,13
The use of sources such as Wikipedia is discouraged,discouraging,9
"You can also use the CIA  -  the World Factbook, Wikipedia, or Yahoo! News for background information.    2",encouraging,18
"Wikipedia is NOT ACCEPTABLE as a resource for this paper.  Skim , Ch",discouraging,13
"244-248 in Art from the Ashes. (Group Presentation 10: Choose a Holocaust movie that is not listed on the syllabus and give your presentation using the criteria we have been studying in class during the semester.)  April 28, 2009  Art: [PERSON] [PERSON], [PERSON] [PERSON], and [PERSON] [PERSON]. We will view and discuss the work of these artists in class.  April 29, 2009  Review and Discussion Paper Due (this grade will be considered incomplete until your paper has been submitted to turnitin.com)  May 12, 2009  Final Exam 2:00 p.m.  Grading Policy Grades will be based on class attendance (15%); participation in class discussions (10%); participation in a group presentation covering an article provided in class by the instructor (5%); one paragraph summarizing one lecture from the Einspruch Holocaust Lecture Series (10%); one test (20%); one 5-8 page paper (20%); and one final (20%). Web sites in general and Wikipedia in particular are not accepted as sources for your papers in this class. All papers must be submitted to turnitin.com",discouraging,168
The student will research the topic for electronic resources in the WWCC database and on the World Wide Web. WIKIPEDIA is not permitted as a resource,discouraging,26
"Citation system to use will be the American Political Science Association system (unless the professor agrees to the use of a different system). NOTE: While there are no requirements in terms of the number of sources used in the presentation, students MUST NOT USE WIKIPEDIA 芒聙聯 using it in your presentation will result in a 10% deduction FOR EACH USE",discouraging,60
"It can be dropped as one file or as 6 separate files. 3  Project Assignment The project will be an in-depth analysis of an international sports team or sporting event of your choosing (with instructor approval). *You will develop your report using Powerpoint. *You will need to gather information from several sources, including internet news reports, official team web pages, printed newspaper and magazine articles, and books. Do not cite Wikipedia! Make sure you have legitimate sources from several formats (not just team blogs and web pages). *Deliverables: Powerpoint slides (13-20 slides); you will need to post these materials on the drop box in D2L by the due date (see schedule)",conditional,111
T he book review should be accompanied by the printout of some article from an Internet web site that pertains in some way to the book that you have reviewed (entries from Wikipedia or Amazon.com will not fulfill this assignment),conditional,40
"for each week that you have a                      discussion post.  Week 6 -   Spring Break 芒聙聯 March 2 芒聙聯 6, 2015    No assignments this week!!!  脗聽脗聽脗聽脗聽脗聽脗聽脗聽脗聽脗聽脗聽脗聽脗聽脗聽脗聽脗聽脗聽脗聽脗聽脗聽脗聽脗聽脗聽脗聽脗聽脗聽脗聽脗聽脗聽脗聽  Week 7脗聽 -脗聽   Beginning March 9, 2015  脗聽脗聽脗聽脗聽脗聽脗聽脗聽脗聽脗聽脗聽脗聽脗聽脗聽脗聽脗聽脗聽脗聽脗聽Read Chapters 11, 13, 14, and 16  脗聽脗聽脗聽脗聽脗聽脗聽脗聽脗聽脗聽脗聽脗聽脗聽脗聽脗聽脗聽脗聽脗聽脗聽Self-Assessments 芒聙聯 Chapter review quizzes in your text.  脗聽脗聽脗聽脗聽脗聽脗聽脗聽脗聽脗聽脗聽脗聽脗聽脗聽脗聽脗聽脗聽脗聽脗聽Test 芒聙聯 (Covers chapters 3, 4, 5, 11, 13, 14 and 16)  脗聽脗聽脗聽脗聽脗聽脗聽脗聽脗聽脗聽脗聽脗聽 脗聽脗聽脗聽脗聽脗聽   Due no later than Sunday, March 15, 2015  脗聽脗聽  Week 8脗聽 -脗聽 Beginning March 16, 2015  脗聽脗聽脗聽脗聽脗聽脗聽脗聽脗聽脗聽脗聽脗聽脗聽脗聽脗聽脗聽脗聽脗聽Start working on Informative Speech  脗聽  脗聽脗聽脗聽脗聽脗聽脗聽脗聽脗聽脗聽脗聽脗聽脗聽脗聽脗聽脗聽脗聽 Your informative speech will be about something that you know about and want to脗聽  脗聽脗聽脗聽脗聽脗聽脗聽脗聽脗聽脗聽脗聽脗聽脗聽脗聽脗聽脗聽脗聽 inform your audience about.脗聽 You may choose something from the list of informative  脗聽脗聽脗聽脗聽脗聽             speech topics or use your own.脗聽 Remember this must be something that you know脗聽  脗聽脗聽脗聽脗聽脗聽             something about or have witnessed and have information to share.脗聽 For example, it  脗聽脗聽 脗聽            脗聽脗聽could be about an illness you have or had or one that a family member has or had that  脗聽脗聽脗聽            脗聽脗聽 has impacted you.脗聽 Most of this speech will come from you and your experience.脗聽  脗聽脗聽脗聽脗聽脗聽             You are required to have one source from each of the following:脗聽 a book, a magazine  脗聽脗聽脗聽脗聽              or newspaper, and the internet.脗聽 Your paper must be at least 4 pages, including a title  脗聽脗聽脗聽脗聽脗聽             page and a works cited page, typed in APA style, 12 Font, Times New Roman, top,  脗聽脗聽脗聽脗聽脗聽             bottom and right margins 1.0 inch, and left margin 1.5 inches.脗聽脗聽 All of your cited  脗聽脗聽脗聽脗聽脗聽             information must be within the last 10 years.脗聽 Do not use Wikipedia",discouraging,436
"Wikipedia.com can be a great resource for finding information quickly and cheaply, but since there is no review process for the information it provides, you may not cite it as a resource for a paper. 6",conditional,36
"Wikipedia is not considered a valid academic source. Do not use it! o For the assignments in this class, it is better to write using first or third person pronouns",discouraging,30
"If you use other people芒聙聶s ideas or work (ex: Wikipedia, Amazon reviews, book reviews from journals, book jacket descriptions, etc.), I will not accept the assignment because it is not your own work",discouraging,33
"Empirical articles present methods and findings. o The following sources are NOT acceptable articles: dissertation abstracts, non-English articles, secondary sources (e.g., textbooks), popular media (e.g., Newsweek, wikipedia). Briefly summarize 2 芒聙聯 3 of the articles most relevant to your research topic (1 芒聙聯 2 sentences per summary). o Bold the reference and your summary should appear directly under the reference  茂聝聵 Outline Assignment (400 - 500 words, outline with APA style citations) in which you organize the main points of your literature review and indicate which sources will be used to support the main point, and how it will do so (e.g., full summary of the article vs. 芒聙聹microsummary芒聙聺 of the article) Purpose  Writing Workshop, PSYC 100W, Spring 2016  Page 11 of 26  芒聙垄 芒聙垄 芒聙垄  Begin to organize literature review Practice 芒聙聹microsummaries芒聙聺 (1 - 2 sentence summaries of sources highlighting main points) Use APA style in-text citations  Reading, Resources, Preparation 芒聙垄 芒聙垄 芒聙垄  APA Manual (6th Edition), chapters 6.00 - 6.21 (Crediting Sources) Microsummaries Handout Please bring or have access to your most current research question/topic description, an APA style list of all the references you have gathered for the paper so far, and any notes you have taken thus far.  Instructions Copy and paste the outline below into a word processing program and insert relevant information. 芒聙垄  芒聙垄  芒聙垄  芒聙垄  Research Topic/Question o describe your research topic/question",discouraging,229
"Failure to do so will be considered intentional plagiarism.  Banned Sources Any work from a professional/purchase essay site (proessays.com, gradesaver.com, antiessay.com, ect), a wiki site (Wikipedia), a grade-saver site (e.g",discouraging,30
"What is your opinion about Buckland's argument? Think about your own everyday information-seeking habits (such as reading entries on Wikipedia, asking a friend a question, looking for resources at the library)",encouraging,31
"(They should, however, represent your own reactions; copying materials from web sources such as Wikipedia counts as plagiarism here as elsewhere.) There are three graded writing assignments for the course",discouraging,30
"Do not use Wikipedia, as it is not a reliable source of information",discouraging,13
You are only allowed to site Wikipedia 2 times throughout your paper. Proposal To choose a topic you MUST present your topic proposal to me prior to starting your research,conditional,30
Students will be penalized for using 芒聙聹Wikipedia芒聙聺 as an academic source for the weekly research papers,discouraging,16
"6 Library Day: introduction to OhioLink, Opposing Viewpoints and Academic Search Premier [PERSON] one book from OhioLink and find three articles on your topic from OV or ASP; DO NOT use .coms, wikipedia or google *homework: read your articles, underlining and annotating as you go Oct",discouraging,46
"The References section must cite all relevant sources, making sure they are credible sources (refereed articles, books, National Bureau of Standards, etc.) as opposed to sources subject to fraud (Wikipedia)",discouraging,30
"To learn more about what plagiarism is and how to avoid it, go to Purdue Online Writing [PERSON][PERSON](OWL) http://owl.english.purdue.edu/owl/resource/589/01/. Never quote or use Wikipedia on any assignment in this class. Houston Community College Mission Statement The Houston Community College is an open-admission, public institution of higher education offering associate degrees, certificates, academic preparation, workforce training, and lifelong learning opportunities that prepare individuals in our diverse communities for life and work in an increasingly international and technological society. HCC will provide affordable and accessible education, university transfer and general education, workforce development, customized training, continuing education, adult literacy and developmental programs, personal enrichment opportunities, comprehensive student support services, and an environment conducive to learning. HCC POLICIES ADA 芒聙聯 Disability Policy Please inform me as soon as possible about any accommodation you will require for this course",discouraging,135
Never use Wikipedia as a resource,discouraging,6
"Some widely available Internet materials, such as Wikipedia, may be based on incorrect, limited, or outdated information",discouraging,17
I do not accept the use of Wikipedia as an information source,discouraging,12
Sites such as Wikipedia are not considered scholarly and will not be accepted. All sources must be cited in accordance with APA standards,discouraging,23
"If there is any doubt, do not use it. Wikipedia is not a reliable reference for anything, even when discussing Wikipedia. Standards body web sites and corporate web sites are acceptable references for discussing their standards and corporations. Weekly Objectives Week 1  Starting Date Aug 23, 2010  2  Aug 30, 2010  3  Sep 6, 2010  4  Sep 13, 2010  5 6  Sep 20, 2010 Sep 27, 2010  7  Oct 4, 2010  8  Oct 11, 2010  Objectives Find and read at least 5 peer-reviewed articles on security topic of choice for paper Formulate problem statement with citations to support relevance. Find and read at least 5 more peerreviewed articles related to the proposed research",discouraging,113
"The Project may be either a research paper of a standard format (minimum five pages, minimum five sources - NO WIKIPEDIA)",discouraging,21
"ANYONE may edit or change ANY ENTRY in Wikipedia, thereby rendering all of it unreliable",discouraging,15
