sentence,stance,sentence_length
"330); discuss synthesis and integrating quotes; work on identifying three main reasons for your argument, then find info in your sources to illustrate and support your ideas (use 2-3 quotes from different sources in each paragraph) *homework: finish identifying, explaining and supporting your ideas March 19 Discussion of homework: group work on argument method *homework: write intro (topic, history (cause and effect), controversy and claim) and body of your synthesis paper (identify three reasons you're going to develop your claim), 3-4 pages March 24 Editing workshop on synthesis paper *homework; revise and type synthesis paper draft (3-4 pages plus Works Cited) March 26 SYNTHESIS PAPER DUE (turn in drafts with final draft stapled to top) Research rest of sources (8-10 total sources: at least two books, two scholarly sources, and two websites--DO NOT use .coms, wikipedia or google) *homework: bring sources to class March 31 Discuss opposition: identify three points and synthesize, using 2-3 quotes from different sources to help explain these points *homework: continue identifying, explaining and illustrating three opposing ideas April 2 Discuss refutation; discuss concession (transitions from Graff); find info from sources *homework: find info from sources to refute opposing points you explained yesterday; synthesize, using quotes from 3-4 different sources in each point April 7 Discuss opposition and refutation information you've been working on in groups *homework: write draft of Opposition/Refutation paper (4-5 pages)--include intro April 9 Editing workshop on Opposition/Refutation paper *homework: revise and type Opposition Refutation paper, including Works Cited April 14 Editing workshop on Opposition/Refutation paper *homework: revise and type Opposition/Refutation paper, including Works Cited April 16 OPPOSITION/REFUTATION PAPER DUE (4-5 pages; include drafts and staple final draft on top) Discuss Research Paper and conclusion: putting it all together April 21 Work on Research Paper (8-10 pages plus Works Cited) April 23 Draft of Research Paper due for editing workshop April 28 Draft of Research Paper due for editing workshop April 30 Draft of Research Paper due for editing workshop May 5 Draft of Research Paper due for editing workshop May 7 FINAL RESEARCH PAPER DUE (8-10 pages, plus Works Cited; include drafts and staple final draft on top) College Information College Mission - The purpose of Clark State Community College is to foster individual and community prosperity through access to the highest quality, learning-centered education",discouraging,383
"When papers are submitted for grades, it should be noted that at no time is Wikipedia an acceptable source for citation",discouraging,21
"Details:  Topic choices DUE on March 27 (Topic Approval Required)  10-12 pages, ds, typed, 1 inch margins, 12 New Times Roman  Appropriate use of 3-5 ACADEMIC SECONDARY sources (no encyclopedias, no book reviews, no cliff notes or spark notes, no Wikipedia, no non-academic websites)",discouraging,44
"Also, Wikipedia and other types of non-academic encyclopedias will under no circumstances be considered legitimate sources!  3  茂聜路 茂聜路 茂聜路  with few exceptions, single & two-digit numbers (zero through ninety-nine) are to be spelled out; three digits are to be written numerically be wary of overuse of abbreviations and/or contractions a staple in the upper left-hand corner (no frilly covers) **Please Note that any in-class work must be done in blue or black ink**  On Writing and Research: As this instructor is particularly driven by written expression, you should expect that there will be an emphasis placed on written expression in this course",discouraging,103
Please see me if you are not sure what outside sources are acceptable (ie: no Wikipedia),discouraging,16
Please note that Wikipedia.com is not allowed as a source for projects or homework in this class. 4,discouraging,18
"I just do not want you to use websites/Wikipedia/online encyclopedias/etc.  ---------------------------------------------------------------------------------------------------------------------------Speech Two [5 minutes]: What happened on your birthday? For this speech, I want you to tell us about an event that happened on the day you were born (it could have happened in another year)",discouraging,46
"Some sources can be from article written by experts in magazines or online, but only if they are verifiable experts and have author names. WARNING: Internet searches will often take you to non-academic information resources such as Wikipedia.com, Ask.com, Answers.com, Encarta.msn.com, Infoplease.com, etc",discouraging,43
"Wikipedia and encyclopedic sources are prohibited (I suggest that you investigate the many excellent scholarly sources available within Excelsior College's Virtual Library; also, ask the librarian for assistance in searching for sources)",discouraging,32
"Foreign Policy Syllabus  page 3 of 5  the   脗聽grade   脗聽book   脗聽of   脗聽BB.   脗聽   脗聽   脗聽    脗聽 It   脗聽is   脗聽the   脗聽student芒聙聶s   脗聽sole   脗聽responsibility   脗聽to   脗聽drop   脗聽the   脗聽class   脗聽if   脗聽s/he   脗聽decides   脗聽to   脗聽no   脗聽longer   脗聽continue   脗聽attending.   脗聽   脗聽It   脗聽is   脗聽the   脗聽 student芒聙聶s   脗聽responsibility   脗聽to   脗聽let   脗聽me   脗聽know   脗聽if   脗聽s/he   脗聽is   脗聽going   脗聽to   脗聽miss   脗聽a   脗聽particular   脗聽class   脗聽session   脗聽(Beyond   脗聽your   脗聽2   脗聽unexcused   脗聽 absences)   脗聽PRIOR   脗聽to   脗聽class   脗聽or   脗聽immediately   脗聽after   脗聽class   脗聽if   脗聽that   脗聽is   脗聽not   脗聽possible.   脗聽   脗聽I   脗聽reserve   脗聽the   脗聽right   脗聽to   脗聽determine   脗聽which   脗聽 absences   脗聽are   脗聽芒聙聹excused.芒聙聺   脗聽   脗聽Generally,   脗聽only   脗聽DOCUMENTED   脗聽medical   脗聽or   脗聽emergency   脗聽situations   脗聽fall   脗聽in   脗聽this   脗聽category.   脗聽   脗聽If   脗聽 these   脗聽absences   脗聽are   脗聽excessive,   脗聽you   脗聽may   脗聽be   脗聽asked   脗聽to   脗聽drop/withdraw   脗聽from   脗聽the   脗聽course.   脗聽    脗聽 Students   脗聽are   脗聽to   脗聽show   脗聽up   脗聽for   脗聽class   脗聽on   脗聽time,   脗聽sign-脗颅芒聙聬in   脗聽and   脗聽leave   脗聽when   脗聽class   脗聽is   脗聽over.   脗聽   脗聽Coming   脗聽late   脗聽or   脗聽leaving   脗聽early   脗聽can   脗聽 constitute   脗聽as   脗聽an   脗聽absence.   脗聽   脗聽I   脗聽DO   脗聽NOT   脗聽ACCEPT   脗聽LATE   脗聽WORK.   脗聽   脗聽   脗聽    脗聽 Statement   脗聽on   脗聽Academic   脗聽Honesty   脗聽and   脗聽Integrity:   脗聽   脗聽 You   脗聽are   脗聽expected   脗聽to   脗聽maintain   脗聽a   脗聽high   脗聽standard   脗聽of   脗聽academic   脗聽integrity.   脗聽I   脗聽will   脗聽ask   脗聽you   脗聽to   脗聽sign   脗聽an   脗聽academic   脗聽honesty   脗聽 statement   脗聽for   脗聽each   脗聽assigned   脗聽work   脗聽you   脗聽turn   脗聽in   脗聽and   脗聽will   脗聽hold   脗聽you   脗聽accountable.   脗聽As   脗聽such,   脗聽plagiarism   脗聽and   脗聽academic   脗聽 dishonesty   脗聽will   脗聽not   脗聽be   脗聽tolerated.   脗聽   脗聽    脗聽 Violation   脗聽of   脗聽these   脗聽standards   脗聽will   脗聽result   脗聽in   脗聽an   脗聽芒聙聹F芒聙聺   脗聽in   脗聽the   脗聽course   脗聽and   脗聽no   脗聽possibility   脗聽of   脗聽withdrawal   脗聽from   脗聽the   脗聽course.   脗聽NO   脗聽 EXCEPTIONS.   脗聽   脗聽That   脗聽means   脗聽if   脗聽you   脗聽cheat,   脗聽plagiarize,   脗聽engage   脗聽in   脗聽any   脗聽sort   脗聽of   脗聽academic   脗聽dishonesty   脗聽including   脗聽failure   脗聽to   脗聽 cite   脗聽sources   脗聽appropriately   脗聽on   脗聽ANY   脗聽portion   脗聽of   脗聽the   脗聽course   脗聽and   脗聽are   脗聽caught芒聙聰you   脗聽will   脗聽automatically   脗聽receive   脗聽an   脗聽芒聙聹F芒聙聺   脗聽in   脗聽 the   脗聽course   脗聽and   脗聽no   脗聽further   脗聽assignments   脗聽will   脗聽be   脗聽honored.   脗聽   脗聽In   脗聽addition,   脗聽at   脗聽the   脗聽discretion   脗聽of   脗聽the   脗聽instructor,   脗聽cases   脗聽may   脗聽 be   脗聽pursued   脗聽even   脗聽further   脗聽according   脗聽to   脗聽departmental   脗聽and   脗聽university   脗聽guidelines.   脗聽Here   脗聽are   脗聽excerpts   脗聽from   脗聽p.   脗聽27   脗聽of   脗聽the   脗聽 Western   脗聽Kentucky   脗聽University   脗聽Undergraduate   脗聽Catalog   脗聽(2001-脗颅芒聙聬2003)   脗聽concerning   脗聽academic   脗聽honesty:   脗聽    脗聽 Academic   脗聽Offenses   脗聽芒聙聯   脗聽The   脗聽maintenance   脗聽of   脗聽academic   脗聽integrity   脗聽is   脗聽of   脗聽fundamental   脗聽importance   脗聽to   脗聽the   脗聽 University.   脗聽Thus   脗聽it   脗聽should   脗聽be   脗聽clearly   脗聽understood   脗聽that   脗聽acts   脗聽of   脗聽plagiarism   脗聽or   脗聽any   脗聽other   脗聽form   脗聽of   脗聽cheating   脗聽will   脗聽 not   脗聽be   脗聽tolerated   脗聽and   脗聽that   脗聽anyone   脗聽committing   脗聽such   脗聽acts   脗聽risks   脗聽punishment   脗聽of   脗聽a   脗聽serious   脗聽nature.   脗聽 Plagiarism   脗聽芒聙聯   脗聽To   脗聽represent   脗聽written   脗聽work   脗聽taken   脗聽from   脗聽another   脗聽source   脗聽as   脗聽one芒聙聶s   脗聽own   脗聽is   脗聽plagiarism.   脗聽Plagiarism   脗聽 is   脗聽a   脗聽serious   脗聽offense.   脗聽The   脗聽academic   脗聽work   脗聽of   脗聽a   脗聽student   脗聽must   脗聽be   脗聽his/her   脗聽own.   脗聽One   脗聽must   脗聽give   脗聽any   脗聽author   脗聽credit   脗聽 for   脗聽source   脗聽material   脗聽borrowed   脗聽from   脗聽him/her.   脗聽To   脗聽lift   脗聽content   脗聽directly   脗聽from   脗聽a   脗聽source   脗聽without   脗聽giving   脗聽credit   脗聽is   脗聽a   脗聽 flagrant   脗聽act.   脗聽To   脗聽present   脗聽a   脗聽borrowed   脗聽passage   脗聽without   脗聽reference   脗聽to   脗聽the   脗聽source   脗聽after   脗聽having   脗聽changed   脗聽a   脗聽few   脗聽 words   脗聽is   脗聽also   脗聽plagiarism.   脗聽 *   脗聽So   脗聽when   脗聽do   脗聽you   脗聽cite   脗聽a   脗聽source?   脗聽If   脗聽you   脗聽have   脗聽ANY   脗聽doubts   脗聽click   脗聽on   脗聽the   脗聽links   脗聽below   脗聽 http://owl.english.purdue.edu/handouts/print/research/r_plagiar.html   脗聽 for   脗聽Purdue   脗聽University芒聙聶s   脗聽Online   脗聽Writing   脗聽Lab   脗聽page   脗聽on   脗聽plagiarism.   脗聽Or   脗聽go   脗聽to   脗聽芒聙聹Turn-脗颅芒聙聬it-脗颅芒聙聬in.com芒聙聺   脗聽for   脗聽 their   脗聽tips-脗颅芒聙聬-脗颅芒聙聬   脗聽http://www.turnitin.com/research_site/e_home.html   脗聽 Or   脗聽if   脗聽you   脗聽are   脗聽in   脗聽doubt,   脗聽email   脗聽me   脗聽or   脗聽call   脗聽me   脗聽and   脗聽or   脗聽go   脗聽to   脗聽the   脗聽Writing   脗聽Center   脗聽for   脗聽guidance.   脗聽    脗聽 **   脗聽   脗聽I   脗聽maintain   脗聽a   脗聽zero-脗颅芒聙聬tolerance   脗聽position   脗聽on   脗聽academic   脗聽dishonesty.   脗聽   脗聽 DO   脗聽NOT   脗聽COLLABORATE   脗聽WITH   脗聽EACH   脗聽OTHER   脗聽ON   脗聽ASSIGNMENTS   脗聽   脗聽OR   脗聽USE   脗聽SOURCES   脗聽WITHOUT   脗聽APPROPRIATE   脗聽 ATTRIBUTION.   脗聽   脗聽**   脗聽   脗聽 I   脗聽DO   脗聽NOTACCEPT   脗聽ANY   脗聽MATERIAL   脗聽FROM   脗聽ONLINE   脗聽DICTIONARIES   脗聽AND   脗聽OR   脗聽ENCYCLOPEDIAS   脗聽such   脗聽as   脗聽WIKIPEDIA;   脗聽Only   脗聽 use   脗聽our   脗聽sources   脗聽and   脗聽or   脗聽SPECIALIZED   脗聽SOCIAL   脗聽SCIENCE   脗聽DICTIONARIES   脗聽AND   脗聽OR   脗聽ENCYCLOPEDIA   脗聽(with   脗聽appropriate   脗聽 citations)   脗聽available   脗聽in   脗聽most   脗聽university   脗聽libraries   脗聽and   脗聽some   脗聽public   脗聽libraries.   脗聽   脗聽WKU芒聙聶s   脗聽are   脗聽in   脗聽the   脗聽area   脗聽past   脗聽Java   脗聽City   脗聽to   脗聽 the   脗聽left   脗聽on   脗聽the   脗聽first   脗聽floor.   脗聽    脗聽 ****   脗聽NOTE:   脗聽All   脗聽of   脗聽your   脗聽Assignments   脗聽and   脗聽Exams   脗聽that   脗聽are   脗聽turned   脗聽in   脗聽via   脗聽email   脗聽or   脗聽the   脗聽Assignment   脗聽Link   脗聽of   脗聽Blackboard   脗聽 need   脗聽to   脗聽include   脗聽the   脗聽following   脗聽statement   脗聽at   脗聽the   脗聽bottom   脗聽(excluding   脗聽discussion   脗聽boards   脗聽and   脗聽Q&A):   脗聽 This   脗聽assignment   脗聽(exam)   脗聽represents   脗聽my   脗聽own   脗聽work.   脗聽I   脗聽have   脗聽not   脗聽incorporated   脗聽into   脗聽this   脗聽assignment   脗聽 (exam)   脗聽any   脗聽**unacknowledged**   脗聽material   脗聽from   脗聽the   脗聽work   脗聽of   脗聽another   脗聽person,   脗聽including   脗聽papers,   脗聽words,   脗聽ideas,   脗聽 information,   脗聽computer   脗聽code,   脗聽data,   脗聽evidence-脗颅芒聙聬organizing   脗聽principles,   脗聽or   脗聽style   脗聽of   脗聽presentation   脗聽taken   脗聽from   脗聽the   脗聽Internet,   脗聽 books,   脗聽periodicals,   脗聽or   脗聽other   脗聽sources.   脗聽   脗聽Word   脗聽Count   脗聽________   脗聽words   脗聽   脗聽SIGNATURE   脗聽(type   脗聽your   脗聽name)   脗聽and   脗聽DATE   脗聽    脗聽 The   脗聽purpose   脗聽of   脗聽this   脗聽is   脗聽to   脗聽make   脗聽the   脗聽author   脗聽cognizant   脗聽that   脗聽any   脗聽material   脗聽from   脗聽another   脗聽should   脗聽be   脗聽given   脗聽proper   脗聽 attribution.   脗聽 Dr",discouraging,1326
"Please note: Citing online encyclopedias such as Wikipedia is not appropriate for graduate level work, but you can use these types of resources for background material to further your understanding of the subject area.  XIV.  Help with APA Format  Conventions are used to help organize the social world",discouraging,48
"All students must have regular access to the internet and have the ability to download and read PDFs by the end of the first week.  The glorious internet: a caution Are you tempted to look at Wikipedia or similar 芒聙聹encyclopedic芒聙聺 sites on the web? Unless specifically instructed, DON芒聙聶T! While such sites can be a useful resource in certain non-academic situations, they are not subject to the rigorous peer-review process expected of scholarly publications",discouraging,73
"(Any kind of written data will suffice: op-eds, news articles, blog posts, Wikipedia pages, political speeches, justifications for political actions, but the student needs to show that he or she has gathered an appropriate sample for the purposes of his or her project.) The paper must involve comparing political understandings of war law with the law itself, as laid down in the treaties themselves and explained in the class readings. Extra Credit Options. Letters to the Editor",encouraging,77
"If your paper has only Internet sources, it is an automatic zero! This includes Wikipedia. - You will use each textbook case as a starting point, then update with additional information through research. - Late papers will not be accepted. - Visit the Writing Lab BEFORE you hand in any papers if you feel you need help 芒聙聯 they are extremely helpful. - Word processing programs have spelling and grammar checking capabilities 芒聙聯 use them! Spring 2010  BA 4305-001  Dr",discouraging,80
(no encyclopedias such as wikipedia),discouraging,5
"6 Library Day: OhioLink, Opposing Viewpoints, Academic Search Premier: find three scholarly articles (each should be at least three pages long) from the search tools given in class (no .com, wikipedia or google as sources) *homework: read [PERSON] [PERSON]",discouraging,39
"As a rule, news organizations and sources such as Wikipedia are not satisfactory references",discouraging,14
"Instead, it makes more sense to embrace the change, and properly train computer science students to use and interpret Internet sources like Wikipedia.  Journal of the Scholarship of Teaching and Learning, Vol",encouraging,32
"The draft should include your experience at the actual site and be approximately 600-750 words. FINAL COPY: The final copy of the Site Visit should include a works cited page that DOES NOT include Wikipedia (or any other encyclopedic web sites), all of the research you completed as related to all rituals, symbols, and theology as well as the information from the actual site visit",discouraging,65
DO NOT use Wikipedia as a reference,discouraging,7
Wikipedia has good entries on most topics covered in this course,encouraging,11
"All research must be credible and appropriate to the assignment as described in class (e.g., 芒聙聹questionable芒聙聺 web pages must be approved by me for credibility, Wikipedia is disallowed, etc.)",discouraging,29
"Because many of the works we will be reading and discussing are part of the canon of great literature, it may be tempting to use summaries such as Wikipedia and [PERSON] [PERSON] to complete assignments. While these tools are valuable for assignments, they should not be used in lieu of reading the works, nor should they be used with an uncritical eye",discouraging,62
"You are required to compile (summarize) the information from the different articles (do not present the information as separate article reviews, but as a cohesive body of information). You may choose to utilize the EBP component with any of the following areas related to your topic: 茂聜路 茂聜路  Etiology Diagnosis 6  Communication in Health Care PTHA 1225 Fall 2015 茂聜路 茂聜路 茂聜路  Prognosis New Medical Intervention PT Intervention  You are also expected to at minimum utilize your current textbooks as well as web related resources (NOT WIKIPEDIA) as resources",discouraging,89
"Do not use Wikipedia. Be careful of plagiarism, DO NOT quote verbatim or copy/paste",discouraging,14
"However, I expect at least one other source to be incorporated into the take-home assignments. * Do not use Wikipedia (10 point deduction). *Worth 100 points (10% of your total grade). * Substance equals 50% followed by grammar 40%, and 10% references",discouraging,42
"The SmartBook also continuously adapts to you by highlighting content different colors based on what you do know and do NOT know. 茂聜路 Both LearnSmart & SmartBook focuses on the content you need to learn, while promoting long-term retention of material芒聙聰helping you study smarter NOT harder! 茂聜路 The LearnSmart assignments are not equal in terms of the time required for completion Interactivity (on Connect website) 6B  This is your major written assignment which will be completed on the connect website; each chapter will contain an interactivity that may consist of a reading passage, news flash or video and questions that require feedback, reaction comments and/or researched responses in the form of short answer and/or short essay responses (worth 15% of your overall grade) 茂聜路 You are required to use college level language skills which includes: complete sentences with appropriate spelling and punctuation (do NOT use abbreviations, slang, or texting lingo like: LOL, IDK) 茂聜路 You must provide reasonable content for a college level student (between 100-200 words but NO MORE THAN 300 WORDS) 茂聜路 You are required gather the material for your response ONLY from your textbook and the Interactivity source (Wikipedia, tabloids, newspapers, blogs, fortune cookies, psychics, palm readers, are NOT considered valid resources)!! 茂聜路 You MUST reference where you got the information or it is considered plagiarism 茂聜路 The following information should follow your reference in parenthesis and highlighted yellow: 1",discouraging,233
Wikipedia is not always a credible source. 芒聙垄 Speech paperwork must be typed,discouraging,13
"Plagiarism: If you use the words of someone else without citing them, you are committing plagiarism and will be penalized on assignments where plagiarism occurs.  Double Spacing:  Double spacing is a basic requirement for any written work assigned.  Encyclopedia or Wikipedia Sources:  Encyclopedia or Wikipedia sources are not acceptable as a source of information",discouraging,54
Online sources (cited or not; or such as Wikipedia) are not accepted,discouraging,12
"Also, do not use Wikipedia as a source for your papers",discouraging,11
"Directions 芒聙垄 Choosing from the list below, each student will write a research report on a writer of the ancient or mediaeval world. 芒聙垄 Use the available print & electronic library resources to research their life, writings, impact and what of their work has survived. 芒聙垄 You will then write a brief 2-3 page report (not counting title page & bibliography) documenting your findings. 芒聙垄 There must be a minimum of three sources used and only approved online resources may be used. WIKIPEDIA IS NOT A HISTORICAL SOURCE. 芒聙垄 Your Reports will be submitted using the Safe Assign submission function",discouraging,100
"For example, citing Wikipedia is always weak, instead cite the sources they cite",conditional,13
